[
  {
    "id": "sinsy",
    "names": {
      "en": "Sinsy",
      "ja": "しぃんしぃ"
    },
    "category": "host",
    "developers": [
      "Nagoya Institute of Technology"
    ],
    "homepage_url": "https://www.sinsy.jp/",
    "tags": [
      "ai",
      "lang:ja",
      "lang:zh",
      "lang:en"
    ]
  },
  {
    "id": "synth-v-studio-2",
    "names": {
      "en": "Synthesizer V Studio 2"
    },
    "category": "host",
    "developers": [
      "Dreamtonics, Co., Ltd."
    ],
    "homepage_url": "https://dreamtonics.com/synthesizerv/",
    "tags": [
      "lang:ja",
      "lang:n",
      "lang:zh",
      "lang:es",
      "lang:ko",
      "ai",
      "synthv",
      "commercial"
    ]
  }
]
