[
  {
    "id": "deepvocal",
    "names": {
      "en": "DeepVocal"
    },
    "category": "host",
    "developers": [
      "Boxstar"
    ],
    "homepage_url": "https://deep-vocal.com/#/",
    "download_page_url": "https://deep-vocal.com/#/Product",
    "tags": [
      "host",
      "free",
      "windows",
      "deepvocal"
    ]
  },
  {
    "id": "diffsinger",
    "names": {
      "en": "DiffSinger"
    },
    "category": "host",
    "developers": [
      "MoonInTheRiver",
      "OpenVPI"
    ],
    "homepage_url": "https://github.com/openvpi/DiffSinger",
    "tags": [
      "open-source",
      "ai"
    ]
  }
]
