[
  {
    "id": "rmvpe",
    "names": {
      "en": "RMVPE: A Robust Model for Vocal Pitch Estimation in Polyphonic Music"
    },
    "category": "host_extension",
    "developers": [
      "Dream-High",
      "yxlllc"
    ],
    "tags": [
      "oudep"
    ],
    "versions": [
      {
        "version": "230917",
        "mirrors": [
          {
            "url": "https://github.com/yqzhishen/RMVPE/releases/download/230917/rmvpe.oudep",
            "hash": "sha256:186194e1fdfbf7c19366b90d79642caef0f785f12f56b2ec54994a364c494682"
          }
        ]
      }
    ]
  }
]
